latitude,longitude,name
35.7420089,139.734487,私立武蔵野中学校
35.7182892,139.5469016,私立武蔵野大学中学校
35.7186034,139.5469536,私立武蔵野大学高等学校
35.6797369,139.5189445,武蔵野学園小学校
35.7416184,139.7348174,私立武蔵野高等学校
35.7359696,139.6671196,私立 武蔵高等学校 中学校
35.6638775,139.7032007,私立渋谷教育学園渋谷中学校
35.663904,139.703106,私立渋谷教育学園渋谷高等学校
35.5693406,139.4676222,私立玉川学園小学部
35.598637,139.6567606,田園調布雙葉中学校
35.5989293,139.6571469,田園調布雙葉高等学校
35.724492,139.451772,私立白梅学園清修中学校
35.725058,139.45118,私立白梅学園高等学校
35.71812,139.680994,私立目白学園中学校
35.71812,139.680994,私立目白研心高等学校
35.623428,139.292198,私立穎明館中学校
35.623428,139.292198,私立穎明館高等学校
35.70442,139.416101,私立立川女子高等学校
35.70068,139.812874,私立立志舎高等学校
35.694315,139.589447,私立立教女学院中学校
35.694092,139.58867,私立立教女学院小学校
35.694315,139.589447,私立立教女学院高等学校
35.7311864,139.7020634,立教池袋中学校
35.7311766,139.7018716,立教池袋高等学校
35.6631624,139.2398576,私立聖パウロ学園高等学校
35.6987131,139.5465094,私立聖徳学園中学校
35.6984415,139.5465036,私立聖徳学園小学校
35.6992132,139.5461808,私立聖徳学園中学・高等学校
35.6421706,139.7262401,私立聖心女子学院中等科
35.6421516,139.7262093,私立聖心女子学院初等科
35.6421308,139.7261778,私立聖心女子学院高等科
35.7056382,139.5763382,私立藤村女子中学校
35.7055753,139.5763423,私立藤村女子高等学校
35.687124,139.68494,私立関東国際高等学校
35.6594793,139.7113139,私立青山学院中等部
35.6581338,139.7113649,私立青山学院初等部
35.6591338,139.7091935,私立青山学院高等部
35.6322585,139.73002,私立頌栄女子学院中学校
35.632297,139.729938,私立頌栄女子学院高等学校
35.656044,139.677414,私立駒場学園高等学校
35.653433,139.682386,私立駒場東邦中学校
35.653433,139.682386,私立駒場東邦高等学校
35.6272349,139.4954055,駒沢学園女子中学校
35.6276197,139.4952004,駒沢学園女子高等学校
35.5814802,139.4955518,私立鶴川高等学校
35.705226,139.434488,立川ろう学校
35.769244,139.330578,羽村養護学校
35.7633097,139.8319642,葛飾ろう学校
35.6515632,139.5947127,旧都立世田谷工業高等学校
35.5483396,139.7157921,東京都立 六郷工科高等学校
35.7025766,139.4279402,東京都立立川国際中等教育学校
35.6526836,139.6246291,東京都立 千歳丘高等学校
35.651592,139.396493,都立南平高等学校
35.728284,139.625749,東京都立 四谷商業高等学校
35.68809,139.448904,ABC
35.7163502,139.3381299,都立多摩工業高等学校
35.7643463,139.5976161,東京都立 大泉桜高等学校
35.74567,139.592556,東京都立大泉高等学校
35.6569496,139.301827,都立富士森高等学校
35.532275,139.46913,都立小川高等学校
35.725585,139.442209,都立小平西高等学校
35.733863,139.484149,都立小平高等学校
35.705423,139.516787,都立小金井北高等学校
35.576741,139.433993,都立山崎高等学校
35.6724022,139.5005128,都立府中工業高等学校
35.656484,139.514594,都立府中東高等学校
35.542613,139.474824,都立成瀬高等学校
35.672673,139.386299,都立日野台高等学校
35.7779536,139.864725,東京都立 本所工業高等学校
35.719119,139.5986195,東京都立 杉並工業高等学校
35.6762785,139.6224712,東京都立 杉並総合高等学校
35.759721,139.47701,都立東村山高等学校
35.7284924,139.6312456,東京都立 武蔵丘高等学校
35.708395,139.53859,都立武蔵高等学校
35.778442,139.538587,都立清瀬東高等学校
35.777021,139.359909,都立瑞穂農芸高等学校
35.5537818,139.4492056,都立町田高等学校
35.7305026,139.5707055,東京都立 石神井高等学校
35.732192,139.30086,都立秋留台高等学校
35.65459,139.317194,東京都立八王子拓真高等学校
35.7393773,139.6268758,東京都立 第四商業高等学校
35.7574366,139.6427668,東京都立 練馬高等学校
35.5486133,139.7156649,.都立六郷工科高等学校
35.654544,139.684497,都立芸術高等学校
35.618461,139.478461,都立若葉総合高等学校
35.680148,139.548868,都立調布北高等学校
35.643959,139.539538,都立調布南高等学校
35.589684,139.43752,都立野津田高等学校
35.655183,139.685274,都立駒場高等学校
35.681205,139.596142,青鳥養護学校久我山分校
35.6887417,139.4179191,星槎大学 星槎国際高等学校 立川学習センター
35.6541836,139.7224024,私立広尾学園高等学校 (Hiroo Gakuen Senior High School)
35.6542554,139.7224375,私立広尾学園中学校 (Hiroo Gakuen Junior High School)
35.6378979,139.7164883,KAIS International School
35.7701469,139.8675585,金町自動車教習所
35.7026841,139.5999613,ヤマハ音楽教室 西荻窪センター
35.6783668,139.7111415,Tokyo Net Wave 専門学校
35.702094,139.5783759,城南予備校
35.6842515,139.6272989,パシフィック ランゲージ スクール
35.7026535,139.5772436,早稲田塾
35.6195767,139.6974176,PLS 西小山校
35.6455143,139.7065665,明蓬館高等学校 恵比寿キャンパス
35.6480067,139.6931913,EXPG || EXILE PROFESSIONAL GYM
35.6448998,139.6981807,明光義塾
35.6428653,139.6968486,EIKO　ゼミナール
35.6484549,139.6685622,D.ST@ATION
35.688524,139.401362,立川市ドリーム学園
35.6497128,139.74556,スターワールド学院
35.7517739,139.8728842,京成ドライビングスクール
35.6643858,139.7034011,ヒコ・みづの　ジュエリーカレッジ
35.655423,139.710935,東京環境工科学園
35.7513118,139.4279457,東大和市立第一中学校
35.7516296,139.4258858,東大和市立第一小学校
35.6998505,139.8302325,汎陽会
35.706536,139.685354,東京テクニカルカレッジ
35.7400817,139.4427598,My English Conversation School
35.6843833,139.701601,東京スクールオブビジネス
35.7117395,139.6015587,杉並高等専修学校
35.7107687,139.6017508,杉並高等専修学校
35.786963,139.6588362,高島平児童館
35.6930589,139.6943531,新宿調理専門学校
35.6833877,139.567688,ヤマハ音楽教室
35.7215889,139.5116766,市立花小金井南中学校
35.7262645,139.5018434,市立小平第三中学校
35.7191763,139.4973545,市立鈴木小学校
35.7282405,139.4914984,市立小平第二小学校
35.7150751,139.4922587,市立小平第三小学校
35.7201587,139.5016755,市立小平第八小学校
35.6658701,139.71583,Clarence International School
35.647334,139.80386,しののめ音楽教室
35.7120027,139.3561652,絵の会
35.6630773,139.7364797,UJS Language Institute
35.667764,139.66132,Hun Hula O Lei Aloha
35.660063,139.343439,東京都立南多摩中等教育学校
35.5969126,139.6665802,秋谷アカデミー
35.7230708,139.7144002,東京音樂大學
34.6859372,139.4342582,町立つつじ小学校
34.6866851,139.433647,大島町立第三中学校
35.7436323,139.805979,Tokyo Kenshu Center
35.5645734,139.7158019,片柳放送センター
35.5648093,139.7164689,アニメ・デザイン館
35.6771731,139.7832058,学校法人ギャラクシー学園 東京ギャラクシー日本語学校
33.069274,139.8058265,三原小学校
35.7381312,139.7635537,中央動物専門学校
35.7603982,139.6230761,区立防災学習センター
35.6494755,139.7289774,アイビープレプインターナショナルスクール
35.7162005,139.7587005,東大弥生
35.7153305,139.7615608,東大本郷(工学系)
35.7157253,139.7635179,東大浅野
35.7104349,139.7637294,東大本郷(薬学系)
35.606908,139.6851211,東工大大岡山
35.7041861,139.6997422,我的学校
35.6990325,139.6994583,東京ワールド日本語学校
35.6966445,139.4181826,小笠原流きもの着付学院
35.7137062,139.6328123,杉九ゆうゆうハウス
35.7021651,139.6309575,杉七学童クラブ
35.7032289,139.7699166,クラーク記念国際高等学校 秋葉原ITキャンパス
35.6865378,139.6989407,Abitus
35.7052154,139.7715782,KTCおおぞら高等学院
35.6992712,139.545528,聖徳学園中学・高等学校
35.70161,139.7661887,お茶の水はりきゅう専門学校
35.7062129,139.7736169,総合芸術教室
35.7043997,139.7742178,サンプレイスポーツトレーナースクール
35.7043195,139.7732538,書道教室 美翠書院
35.7079525,139.7719411,日建学院
35.702898,139.7632491,佐鳴予備校
35.7010539,139.7460312,歯学部学生個別指導塾ADO
35.7003931,139.7463175,大原日本語学院
35.7100635,139.682373,東京愛犬専門学校
35.7026616,139.7724942,パン屋の英会話教室LEON
35.6939937,139.790661,東京医学技術専門学校
35.703007,139.6492761,日本動物専門学校
35.7087199,139.7728847,英会話イーオン
35.7065588,139.771457,中央進
35.7054332,139.7652112,装道礼法きもの学院
35.7063478,139.7654616,東京こども専門学校
35.66516,139.7588316,日本イスパノアカデミー
35.705969,139.7689395,古流いけばな教室
35.7058198,139.7697254,東京都畳高等職業訓練校
35.6608714,139.7053443,グノーブル
35.6609335,139.7051981,清水とき・きものアカデミア
35.7066061,139.766787,文京区立湯島生涯学習館
35.7089352,139.6806073,東京ブライダル専門学校
35.7070363,139.7668219,アフタースクールAEL湯島
35.6523627,139.7293132,Willowbrook International School
35.7053441,139.7723476,KTC中央高等学院
35.6549415,139.694498,ながぬま日本語学校
35.7068499,139.7706454,きこえとことばの教室
35.7057425,139.7651991,東京こども専門学校
35.7209643,139.7061771,Japan College of Foreign Languages (JCFL)
35.7380062,139.7642494,中央工学校
35.7031844,139.7707332,クラーク記念国際高等学校
35.7337476,139.7632107,道灌山学園2号館
35.7379497,139.7441868,中央聖書神学校
35.6927668,139.7608747,HAPPY COOKING
35.6132554,139.7439976,ITTO個別指導学院
35.6206378,139.7411518,SEED　Academy
35.7586386,139.7186768,東京朝鮮中高級学校
35.7489279,139.7743481,北豊島 医療専門学校
35.6999698,139.5006751,都立多摩科学技術高等学校
35.6368237,139.784106,江東区立有明西学園
35.7036872,139.7615199,学建書院
35.706235,139.7599122,柏屋實業裁縫養成所
35.704562,139.7609424,東京外国語大学 本郷サテライト
35.7044034,139.7746987,東京上野日本語学院
35.6958035,139.7748671,鹿島学園高等学校
35.7037752,139.7584826,日本中医学院 調理実習室
35.7158659,139.7483255,中国書道芸術学院
35.6341901,139.3242594,ウイニングショットインドアテニススクール八王子校
35.6336387,139.330567,ITTO個別指導学院 八王子みなみ野校
35.699756,139.7845207,ときわ珠算学習塾
27.0946001,142.1925527,素潜りの学校
35.7385602,139.4609254,職業能力開発総合大学校
35.7562569,139.7328313,中央工学校
35.7681782,139.6397468,むつみ台英会話教室
35.7398265,139.7092908,東京交通短期大学
35.7250426,139.7116215,武蔵野調理師専門学校
35.725278,139.7115724,武蔵野栄養専門学校
35.7263273,139.7138201,駿台予備学校 池袋校
35.7336424,139.7770937,赤門会日本語学校　本校２号館
35.6797782,139.3337719,創価大学秋桜寮
35.6647003,139.8131474,臨床福祉専門学校
35.7246663,139.7120658,武蔵野ファッションカレッジ
35.6582583,139.7923351,シンフォニア保育園 本園
35.7247173,139.7179929,中央法律専門学校
35.7430568,139.7344253,西ケ原南保育園
35.7113577,139.7469949,日本指圧専門学校
35.7289899,139.7357419,ユリカヴァイオリンスクール
35.6996373,139.7549363,SAY YOU LAB
35.7462414,139.6818167,筑波大学付属 桐が丘特別支援学校 施設併設学級
35.7004062,139.7546473,Kudan
35.544728,139.4414359,アルファ医療福祉専門学校（3号館）
35.5477201,139.4423841,アルファ医療福祉専門学校（2号館）
35.6167523,139.6752331,KAIS Elementary & Middle School
35.7091833,139.6809337,KUMON
35.7118335,139.705754,日本フラワーデザイン専門学校
35.7153361,139.7038135,千駄ヶ谷日本語学校
35.7151974,139.7029495,医学部予備校
35.7157201,139.7033591,日本外国語専門学校
35.7053785,139.490142,東京学芸大学
35.6795327,139.7764562,中央区立 城東小学校
35.6581589,139.756383,Seven seas international school
35.6710932,139.5923152,給田小学校
35.654019,139.7307836,Sumerhill
35.6826837,139.5680943,プレジーエデュケーション
35.7384601,139.7695873,東京日本語学校
35.7382694,139.7700477,秀徳教育学院
35.696066,139.6926328,KTCおおぞら高等学院 東京キャンパス
35.6653361,139.6938984,株式会社NHKグローバルメディアサービス バイリンガルセンター 国際研修室
35.7410494,139.7091912,豊島学院高等学校
35.7068697,139.7656739,飛鳥未来きずな高等学校
35.7084649,139.716235,早稲田医学院 歯科衛生士専門学校
35.5918671,139.731092,IWC国際市民の会
35.7435695,139.6824009,キャメロットインターナショナルスクール
35.705365,139.797831,牧野珠算学校
35.7000702,139.7872905,Blast! School
35.7083394,139.618173,さざんかステップアップ教室荻窪教室
35.6942776,139.7700075,神田音楽学校
35.6965075,139.7552862,九段観光ビジネス専門学校
35.6950341,139.6966356,SEG
35.6947688,139.6963204,SEG
35.6811897,139.7020163,日本ナレーション演技研究所
35.6613116,139.7261871,青二塾
35.6577426,139.6497395,世田谷区医師会立看護高等専修学校
35.6021228,139.7261583,品川翔英高等学校
35.7120019,139.6690124,amps
35.6506052,139.3843487,日野市立平山中学校
35.6461513,139.3801507,スクールIE平山南平校
35.6747923,139.4806473,府中看護高等専修学校
35.6461498,139.3801658,個別指導塾スクールIE
35.6567416,139.7329906,Sun Kids Azabujuban
35.6338613,139.7308664,スクールIE 高輪台高
35.7985503,139.2888341,SOROMI
35.7341417,139.7859474,中央医療学園専門学校
35.6659172,139.7066583,ON田スタジオ
35.6997606,139.5006711,都立小金井工業高等学校
35.7595135,139.3171925,早稲田アカデミー
35.7126196,139.3625006,代々木個別指導学院
35.7875659,139.2544303,かわむら珠算塾
35.7900748,139.2587978,明光義塾青梅教室
35.7160701,139.7055479,千駄ヶ谷日本語教育研究所附属日本語学校（第３校舎）
35.7010363,139.4836443,武蔵野美術学院
35.7298825,139.2249539,スクールＩＥ武蔵五日市校
35.7123543,139.3579079,昭島学院
35.6572191,139.3404614,Ｚ会進学教室
35.6578674,139.3395757,早稲田アカデミー
35.7342472,139.7090085,早稲田アカデミー
35.7331392,139.7081169,日建学院
35.6073023,139.6696593,栄光ゼミナール
35.6093852,139.6677909,公文式自由が丘カトレア通り教室
35.6835339,139.4472338,ＩＴＴＯ個別指導学院
35.6064565,139.6676941,早稲田塾
35.6093656,139.6690186,東京個別指導学院
35.6084193,139.6672985,河合塾マナビス
35.6091335,139.6698952,グレッグ外語専門学校
35.609454,139.668962,城南コベッツ
35.6056245,139.6672957,熱中数学塾
35.6065337,139.6702347,スイング幼児教室自由が丘校
35.7606381,139.4676012,臨海セミナー
35.6621232,139.4115545,明光義塾
35.6078677,139.6671149,ヤマハ音楽教室
35.7007663,139.4171419,四谷学院個別指導教室立川
35.7602912,139.4666395,明光義塾東村山駅前教室
35.7610939,139.4678856,個別指導学院　フリーステップ
35.6580196,139.6934423,国際文化理容美容専門学校渋谷校
35.7607801,139.470256,個別指導　アクシス
